,question,answer,contexts,ground_truth,context_relevancy,context_precision,context_recall,faithfulness,answer_relevancy
0,¿Qué beneficios para la salud tiene la cocina mediterránea?,"La cocina mediterránea tiene beneficios para la salud, incluyendo la prevención de enfermedades cardiovasculares y la promoción de un envejecimiento saludable.","['La cocina mediterránea, reconocida mundialmente por su saludable enfoque,\ndestaca por el empleo generoso de aceite de oliva virgen extra, una variedad de\nvegetales frescos y una amplia gama de productos naturales.'
 'beneficios para la salud, desde la prevención de enfermedades cardiovasculares\nhasta la promoción de un envejecimiento saludable.\nHoy, la atención deportiva se centra en la emocionante semifinal de la Copa de'
 'transporte.']",Desde la prevención de enfermedades cardiovasculares hasta la promoción de un envejecimiento saludable.,0.2857142857142857,0.9999999999,1.0,1.0,0.9955653404594388
1,¿Cuál es el sello distintivo de la cocina mediterránea?,"El sello distintivo de la cocina mediterránea es el empleo generoso de aceite de oliva virgen extra, una variedad de vegetales frescos y una amplia gama de productos naturales.","['La cocina mediterránea, reconocida mundialmente por su saludable enfoque,\ndestaca por el empleo generoso de aceite de oliva virgen extra, una variedad de\nvegetales frescos y una amplia gama de productos naturales.'
 'Europa, donde el prestigioso Real Madrid se enfrenta al poderoso Bayern de Múnich.\nEste encuentro promete una exhibición de talento y estrategia, mientras millones de\nfanáticos en todo el mundo esperan ansiosamente el desenlace.'
 'transporte.']",Los sabores vibrantes y la simplicidad,0.0,0.9999999999,1.0,1.0,1.0000000000000002
2,¿Quién se enfrenta al Real Madrid?,El Real Madrid se enfrenta al Bayern de Múnich.,"['Europa, donde el prestigioso Real Madrid se enfrenta al poderoso Bayern de Múnich.\nEste encuentro promete una exhibición de talento y estrategia, mientras millones de\nfanáticos en todo el mundo esperan ansiosamente el desenlace.'
 'ambiente, proporcionando variedad de perspectivas y contribuciones a la\nconversación y la interacción.'
 'Los sabores vibrantes y la simplicidad son el sello distintivo de la cocina\nmediterránea, donde los ingredientes de alta calidad se combinan con técnicas de\ncocción sencillas para realzar su sabor natural. Desde las olivas y los tomates hasta']",El Bayern de Munich,0.1111111111111111,0.9999999999,1.0,1.0,0.9448536473011545
3,¿Qué se espera del partido?,"Se espera que el partido entre el prestigioso Real Madrid y el poderoso Bayern de Múnich sea una exhibición de talento y estrategia, mientras millones de fanáticos en todo el mundo esperan ansiosamente el desenlace.","['Además, la dimensión de la familia juega un papel crucial en esta dinámica, ya que\ncuantos más miembros participen, mayor será la diversión y el sentido de\ncomunidad compartida. La familia extendida puede enriquecer aún más este'
 'Europa, donde el prestigioso Real Madrid se enfrenta al poderoso Bayern de Múnich.\nEste encuentro promete una exhibición de talento y estrategia, mientras millones de\nfanáticos en todo el mundo esperan ansiosamente el desenlace.'
 'El auge de los vehículos eléctricos se vislumbra como un paso significativo hacia un\nfuturo más sostenible y respetuoso con el medio ambiente. Sin embargo, persiste la\nincertidumbre sobre si estos vehículos se convertirán en la principal opción de']",Un duelo lleno de intensidad y emoción,0.0,0.49999999995,0.0,1.0,0.9119412924119082
4,¿Cuál es el desafío relacionado con las bacterias en la estación espacial?,El desafío relacionado con las bacterias en la estación espacial es la proliferación de bacterias que están experimentando mutaciones distintas a las observadas en la Tierra.,"['desafíos, y uno de los más intrigantes se manifiesta en la forma de bacterias que se\nadaptan y mutan de maneras inesperadas en el entorno único de una estación\nespacial. Estas mutaciones, diferentes a las que se observan en la Tierra, despiertan'
 'semifinal de la Copa de Europa.\nEn el entorno de la estación espacial, surge un desafío significativo: la proliferación\nde bacterias que están experimentando mutaciones distintas a las observadas en'
 'en el espacio y su posible impacto en futuras misiones y la exploración\ninterplanetaria.']",La proliferación de bacterias que están experimentando mutaciones distintas a las observadas en condiciones terrestres,0.3333333333333333,0.99999999995,1.0,1.0,1.0000000000000007
5,¿Qué plantea el fenómeno de las mutaciones bacterianas?,"El fenómeno de las mutaciones bacterianas plantea desafíos intrigantes, ya que las bacterias se adaptan y mutan de maneras inesperadas en el entorno único de una estación espacial. Estas mutaciones son diferentes a las que se observan en la Tierra, lo cual despierta un interés particular.","['desafíos, y uno de los más intrigantes se manifiesta en la forma de bacterias que se\nadaptan y mutan de maneras inesperadas en el entorno único de una estación\nespacial. Estas mutaciones, diferentes a las que se observan en la Tierra, despiertan'
 'La atmósfera eléctrica envuelve el estadio mientras los aficionados se preparan para\npresenciar un enfrentamiento legendario entre dos gigantes del fútbol europeo. Con\njugadores de clase mundial en ambos lados del campo, se espera un duelo lleno de'
 'transporte.']","No solo preguntas científicas fundamentales, sino también dilemas éticos y prácticos sobre la gestión de la vida
en el espacio y su posible impacto en futuras misiones y la exploración interplanetaria.",0.0,0.9999999999,0.0,1.0,0.9571234687093281
6,¿Cómo fortalece compartir una comida los lazos familiares?,"Compartir una comida fortalece los lazos familiares al fomentar la conexión emocional y cultivar momentos de alegría, ya que la reunión en torno a la mesa permite que los miembros de la familia se unan y compartan experiencias afectivas.","['La importancia de la unidad familiar se destaca en la afirmación de que compartir\nuna comida fortalece los lazos afectivos. Cuando la familia se reúne en torno a la\nmesa, se fomenta la conexión emocional y se cultivan momentos de alegría y'
 'Los sabores vibrantes y la simplicidad son el sello distintivo de la cocina\nmediterránea, donde los ingredientes de alta calidad se combinan con técnicas de\ncocción sencillas para realzar su sabor natural. Desde las olivas y los tomates hasta'
 'Europa, donde el prestigioso Real Madrid se enfrenta al poderoso Bayern de Múnich.\nEste encuentro promete una exhibición de talento y estrategia, mientras millones de\nfanáticos en todo el mundo esperan ansiosamente el desenlace.']",Fomentando la conexión emocional y se cultivan momentos de alegría y camaradería,0.0,0.9999999999,1.0,1.0,0.9336396654405753
7,¿Por qué se destaca la participación de más miembros en las reuniones familiares?,"La participación de más miembros en las reuniones familiares se destaca porque cuantos más miembros participen, mayor será la diversión y el sentido de comunidad compartida. Además, la familia extendida puede enriquecer aún más este sentido de camaradería.","['Además, la dimensión de la familia juega un papel crucial en esta dinámica, ya que\ncuantos más miembros participen, mayor será la diversión y el sentido de\ncomunidad compartida. La familia extendida puede enriquecer aún más este'
 'desafíos, y uno de los más intrigantes se manifiesta en la forma de bacterias que se\nadaptan y mutan de maneras inesperadas en el entorno único de una estación\nespacial. Estas mutaciones, diferentes a las que se observan en la Tierra, despiertan'
 'camaradería.']","Porque cuantos más miembros participen, mayor será la diversión y el sentido de comunidad compartida",0.2222222222222222,0.9999999999,1.0,1.0,1.0000000000000002
8,¿Qué incertidumbre hay sobre los vehículos eléctricos?,La incertidumbre sobre los vehículos eléctricos persiste en cuanto a si se convertirán en la principal opción de transporte.,"['El auge de los vehículos eléctricos se vislumbra como un paso significativo hacia un\nfuturo más sostenible y respetuoso con el medio ambiente. Sin embargo, persiste la\nincertidumbre sobre si estos vehículos se convertirán en la principal opción de'
 'Los vehículos eléctricos representan una alternativa prometedora a los\ncombustibles fósiles, ofreciendo la posibilidad de reducir las emisiones de gases de\nefecto invernadero y mitigar los impactos del cambio climático. Su funcionamiento'
 'transporte.']","Si estos vehículos se convertirán en la principal opción de
transporte",0.1111111111111111,0.49999999995,1.0,1.0,0.9491577641981334
9,¿Por qué los vehículos eléctricos son una alternativa a los de combustión fósil?,Los vehículos eléctricos son una alternativa a los de combustión fósil porque ofrecen la posibilidad de reducir las emisiones de gases de efecto invernadero y mitigar los impactos del cambio climático.,"['Los vehículos eléctricos representan una alternativa prometedora a los\ncombustibles fósiles, ofreciendo la posibilidad de reducir las emisiones de gases de\nefecto invernadero y mitigar los impactos del cambio climático. Su funcionamiento'
 'Europa, donde el prestigioso Real Madrid se enfrenta al poderoso Bayern de Múnich.\nEste encuentro promete una exhibición de talento y estrategia, mientras millones de\nfanáticos en todo el mundo esperan ansiosamente el desenlace.'
 'transporte.']",Porque ofrecen la posibilidad de reducir las emisiones de gases de efecto invernadero y mitigar los impactos del cambio climático,0.125,0.8333333332916666,1.0,1.0,1.000000000000001
