,question,answer,contexts,ground_truth,context_relevancy,context_precision,context_recall,faithfulness,answer_relevancy
0,¿Qué beneficios para la salud tiene la cocina mediterránea?,"La cocina mediterránea tiene varios beneficios para la salud, incluyendo la reducción del riesgo de enfermedades cardiovasculares, mejoras en la salud cerebral y la prevención de enfermedades crónicas. Esto se debe a su enfoque en alimentos frescos y naturales como frutas, verduras, legumbres, pescado, aceite de oliva y frutos secos, así como a su bajo contenido en grasas saturadas y azúcares refinados.",[],Desde la prevención de enfermedades cardiovasculares hasta la promoción de un envejecimiento saludable.,0.0,0.0,1.0,1.0,0.988565338993285
1,¿Cuál es el sello distintivo de la cocina mediterránea?,El sello distintivo de la cocina mediterránea son los sabores vibrantes y la simplicidad.,"['La cocina mediterránea, reconocida mundialmente por su saludable enfoque,\ndestaca por el empleo generoso de aceite de oliva virgen extra, una variedad de\nvegetales frescos y una amplia gama de productos naturales.\nLos sabores vibrantes y la simplicidad son el sello distintivo de la cocina\nmediterránea, donde los ingredientes de alta calidad se combinan con técnicas de\ncocción sencillas para realzar su sabor natural. Desde las olivas y los tomates hasta\nlas hierbas aromáticas y el pescado fresco, cada bocado es una celebración de la\nabundancia y la frescura de los ingredientes locales. La dieta mediterránea no solo\nes una delicia para el paladar, sino que también se ha asociado con una serie de\nbeneficios para la salud, desde la prevención de enfermedades cardiovasculares\nhasta la promoción de un envejecimiento saludable.\nHoy, la atención deportiva se centra en la emocionante semifinal de la Copa de\nEuropa, donde el prestigioso Real Madrid se enfrenta al poderoso Bayern de Múnich.']",Los sabores vibrantes y la simplicidad,0.13333333333333333,0.9999999999,1.0,1.0,0.9999999999999997
2,¿Quién se enfrenta al Real Madrid?,El Real Madrid se enfrenta al Bayern de Múnich.,"['La cocina mediterránea, reconocida mundialmente por su saludable enfoque,\ndestaca por el empleo generoso de aceite de oliva virgen extra, una variedad de\nvegetales frescos y una amplia gama de productos naturales.\nLos sabores vibrantes y la simplicidad son el sello distintivo de la cocina\nmediterránea, donde los ingredientes de alta calidad se combinan con técnicas de\ncocción sencillas para realzar su sabor natural. Desde las olivas y los tomates hasta\nlas hierbas aromáticas y el pescado fresco, cada bocado es una celebración de la\nabundancia y la frescura de los ingredientes locales. La dieta mediterránea no solo\nes una delicia para el paladar, sino que también se ha asociado con una serie de\nbeneficios para la salud, desde la prevención de enfermedades cardiovasculares\nhasta la promoción de un envejecimiento saludable.\nHoy, la atención deportiva se centra en la emocionante semifinal de la Copa de\nEuropa, donde el prestigioso Real Madrid se enfrenta al poderoso Bayern de Múnich.']",El Bayern de Munich,0.06666666666666667,0.9999999999,1.0,1.0,0.9574650138912686
3,¿Qué se espera del partido?,"Se espera un duelo lleno de intensidad y emoción, con hábiles pases e impresionantes goles, llevando a los espectadores al borde de sus asientos en esta emocionante semifinal de la Copa de Europa.","['Este encuentro promete una exhibición de talento y estrategia, mientras millones de\nfanáticos en todo el mundo esperan ansiosamente el desenlace.\nLa atmósfera eléctrica envuelve el estadio mientras los aficionados se preparan para\npresenciar un enfrentamiento legendario entre dos gigantes del fútbol europeo. Con\njugadores de clase mundial en ambos lados del campo, se espera un duelo lleno de\nintensidad y emoción. Desde los hábiles pases hasta los impresionantes goles, cada\nmomento de este partido crucial llevará a los espectadores al borde de sus asientos,\nmientras el destino de ambos equipos pende de un hilo en esta emocionante\nsemifinal de la Copa de Europa.\nEn el entorno de la estación espacial, surge un desafío significativo: la proliferación\nde bacterias que están experimentando mutaciones distintas a las observadas en\ncondiciones terrestres, planteando interrogantes sobre su comportamiento y\nadaptación en entornos extraterrestres.']",Un duelo lleno de intensidad y emoción,0.0,0.9999999999,1.0,1.0,0.8893064913838248
4,¿Cuál es el desafío relacionado con las bacterias en la estación espacial?,"El desafío relacionado con las bacterias en la estación espacial es la proliferación de bacterias que están experimentando mutaciones distintas a las observadas en condiciones terrestres, lo cual plantea interrogantes sobre su comportamiento y adaptación en entornos extraterrestres.","['Este encuentro promete una exhibición de talento y estrategia, mientras millones de\nfanáticos en todo el mundo esperan ansiosamente el desenlace.\nLa atmósfera eléctrica envuelve el estadio mientras los aficionados se preparan para\npresenciar un enfrentamiento legendario entre dos gigantes del fútbol europeo. Con\njugadores de clase mundial en ambos lados del campo, se espera un duelo lleno de\nintensidad y emoción. Desde los hábiles pases hasta los impresionantes goles, cada\nmomento de este partido crucial llevará a los espectadores al borde de sus asientos,\nmientras el destino de ambos equipos pende de un hilo en esta emocionante\nsemifinal de la Copa de Europa.\nEn el entorno de la estación espacial, surge un desafío significativo: la proliferación\nde bacterias que están experimentando mutaciones distintas a las observadas en\ncondiciones terrestres, planteando interrogantes sobre su comportamiento y\nadaptación en entornos extraterrestres.'
 'La expansión del conocimiento humano hacia el espacio exterior no está exenta de\ndesafíos, y uno de los más intrigantes se manifiesta en la forma de bacterias que se\nadaptan y mutan de maneras inesperadas en el entorno único de una estación\nespacial. Estas mutaciones, diferentes a las que se observan en la Tierra, despiertan\ncuestionamientos profundos sobre cómo la vida se adapta y evoluciona en\ncondiciones extraterrestres. Este fenómeno plantea no solo preguntas científicas\nfundamentales, sino también dilemas éticos y prácticos sobre la gestión de la vida\nen el espacio y su posible impacto en futuras misiones y la exploración\ninterplanetaria.']",La proliferación de bacterias que están experimentando mutaciones distintas a las observadas en condiciones terrestres,0.07692307692307693,0.99999999995,1.0,1.0,1.0
5,¿Qué plantea el fenómeno de las mutaciones bacterianas?,"El fenómeno de las mutaciones bacterianas plantea cuestionamientos profundos sobre cómo la vida se adapta y evoluciona en condiciones extraterrestres, así como dilemas éticos y prácticos sobre la gestión de la vida en el espacio y su posible impacto en futuras misiones y la exploración interplanetaria.","['Este encuentro promete una exhibición de talento y estrategia, mientras millones de\nfanáticos en todo el mundo esperan ansiosamente el desenlace.\nLa atmósfera eléctrica envuelve el estadio mientras los aficionados se preparan para\npresenciar un enfrentamiento legendario entre dos gigantes del fútbol europeo. Con\njugadores de clase mundial en ambos lados del campo, se espera un duelo lleno de\nintensidad y emoción. Desde los hábiles pases hasta los impresionantes goles, cada\nmomento de este partido crucial llevará a los espectadores al borde de sus asientos,\nmientras el destino de ambos equipos pende de un hilo en esta emocionante\nsemifinal de la Copa de Europa.\nEn el entorno de la estación espacial, surge un desafío significativo: la proliferación\nde bacterias que están experimentando mutaciones distintas a las observadas en\ncondiciones terrestres, planteando interrogantes sobre su comportamiento y\nadaptación en entornos extraterrestres.'
 'La expansión del conocimiento humano hacia el espacio exterior no está exenta de\ndesafíos, y uno de los más intrigantes se manifiesta en la forma de bacterias que se\nadaptan y mutan de maneras inesperadas en el entorno único de una estación\nespacial. Estas mutaciones, diferentes a las que se observan en la Tierra, despiertan\ncuestionamientos profundos sobre cómo la vida se adapta y evoluciona en\ncondiciones extraterrestres. Este fenómeno plantea no solo preguntas científicas\nfundamentales, sino también dilemas éticos y prácticos sobre la gestión de la vida\nen el espacio y su posible impacto en futuras misiones y la exploración\ninterplanetaria.']","No solo preguntas científicas fundamentales, sino también dilemas éticos y prácticos sobre la gestión de la vida
en el espacio y su posible impacto en futuras misiones y la exploración interplanetaria.",0.15384615384615385,0.49999999995,1.0,1.0,1.0000000000000002
6,¿Cómo fortalece compartir una comida los lazos familiares?,"Compartir una comida fortalece los lazos familiares al crear un espacio para la comunicación y la conexión entre los miembros de la familia. Este acto permite que todos se reúnan, conversen y compartan experiencias y sentimientos, lo que puede mejorar la comprensión y el apoyo mutuo. Además, las comidas compartidas pueden convertirse en una tradición familiar que refuerza el sentido de pertenencia y unidad.",[],Fomentando la conexión emocional y se cultivan momentos de alegría y camaradería,0.0,0.0,1.0,1.0,0.945762678447181
7,¿Por qué se destaca la participación de más miembros en las reuniones familiares?,La participación de más miembros en las reuniones familiares se destaca porque permite que todos se mantengan al tanto de lo que está ocurriendo en la vida de los demás.,[],"Porque cuantos más miembros participen, mayor será la diversión y el sentido de comunidad compartida",0.0,0.0,0.0,1.0,0.9999999999999991
8,¿Qué incertidumbre hay sobre los vehículos eléctricos?,La incertidumbre sobre los vehículos eléctricos radica en si se convertirán en la principal opción de transporte.,"['El auge de los vehículos eléctricos se vislumbra como un paso significativo hacia un\nfuturo más sostenible y respetuoso con el medio ambiente. Sin embargo, persiste la\nincertidumbre sobre si estos vehículos se convertirán en la principal opción de\ntransporte.']","Si estos vehículos se convertirán en la principal opción de
transporte",0.2,0.9999999999,1.0,1.0,0.9793127176519739
9,¿Por qué los vehículos eléctricos son una alternativa a los de combustión fósil?,Los vehículos eléctricos son una alternativa a los de combustión fósil porque no emiten gases contaminantes y utilizan fuentes de energía más sostenibles.,[],Porque ofrecen la posibilidad de reducir las emisiones de gases de efecto invernadero y mitigar los impactos del cambio climático,0.0,0.0,1.0,1.0,0.9999999999999994
