,question,answer,contexts,ground_truth,context_relevancy,context_precision,context_recall,faithfulness,answer_relevancy
0,¿Qué beneficios para la salud tiene la cocina mediterránea?,"Lo siento, pero no puedo proporcionar una respuesta basada en el contexto proporcionado ya que no se ha incluido ninguno.",[],Desde la prevención de enfermedades cardiovasculares hasta la promoción de un envejecimiento saludable.,0.0,0.0,1.0,,0.0
1,¿Cuál es el sello distintivo de la cocina mediterránea?,El contexto proporcionado no incluye información suficiente para responder a la pregunta sobre el sello distintivo de la cocina mediterránea.,[],Los sabores vibrantes y la simplicidad,0.0,0.0,0.0,,0.0
2,¿Quién se enfrenta al Real Madrid?,El Bayern de Múnich se enfrenta al Real Madrid.,"['Europa, donde el prestigioso Real Madrid se enfrenta al poderoso Bayern de Múnich.\nEste encuentro promete una exhibición de talento y estrategia, mientras millones de\nfanáticos en todo el mundo esperan ansiosamente el desenlace.']",El Bayern de Munich,0.3333333333333333,0.9999999999,1.0,1.0,0.9104913292964455
3,¿Qué se espera del partido?,"Se espera que el partido esté lleno de intensidad y emoción, con hábiles pases e impresionantes goles, llevando a los espectadores al borde de sus asientos mientras el destino de ambos equipos pende de un hilo.","['intensidad y emoción. Desde los hábiles pases hasta los impresionantes goles, cada\nmomento de este partido crucial llevará a los espectadores al borde de sus asientos,\nmientras el destino de ambos equipos pende de un hilo en esta emocionante']",Un duelo lleno de intensidad y emoción,0.75,0.9999999999,1.0,1.0,0.9934491550123221
4,¿Cuál es el desafío relacionado con las bacterias en la estación espacial?,"El desafío relacionado con las bacterias en la estación espacial es su proliferación y las mutaciones que experimentan, las cuales son distintas a las observadas en la Tierra.","['semifinal de la Copa de Europa.\nEn el entorno de la estación espacial, surge un desafío significativo: la proliferación\nde bacterias que están experimentando mutaciones distintas a las observadas en'
 'desafíos, y uno de los más intrigantes se manifiesta en la forma de bacterias que se\nadaptan y mutan de maneras inesperadas en el entorno único de una estación\nespacial. Estas mutaciones, diferentes a las que se observan en la Tierra, despiertan']",La proliferación de bacterias que están experimentando mutaciones distintas a las observadas en condiciones terrestres,0.42857142857142855,0.99999999995,1.0,1.0,1.0
5,¿Qué plantea el fenómeno de las mutaciones bacterianas?,"El fenómeno de las mutaciones bacterianas plantea un desafío significativo en el entorno de la estación espacial, ya que las bacterias están experimentando mutaciones distintas a las observadas en la Tierra.","['semifinal de la Copa de Europa.\nEn el entorno de la estación espacial, surge un desafío significativo: la proliferación\nde bacterias que están experimentando mutaciones distintas a las observadas en'
 'desafíos, y uno de los más intrigantes se manifiesta en la forma de bacterias que se\nadaptan y mutan de maneras inesperadas en el entorno único de una estación\nespacial. Estas mutaciones, diferentes a las que se observan en la Tierra, despiertan']","No solo preguntas científicas fundamentales, sino también dilemas éticos y prácticos sobre la gestión de la vida
en el espacio y su posible impacto en futuras misiones y la exploración interplanetaria.",0.0,0.49999999995,1.0,1.0,0.8653795240053376
6,¿Cómo fortalece compartir una comida los lazos familiares?,"Lo siento, pero no puedo responder a la pregunta con el contexto proporcionado.",[],Fomentando la conexión emocional y se cultivan momentos de alegría y camaradería,0.0,0.0,0.0,,0.0
7,¿Por qué se destaca la participación de más miembros en las reuniones familiares?,No hay información suficiente en el contexto proporcionado para responder a la pregunta sobre por qué se destaca la participación de más miembros en las reuniones familiares.,[],"Porque cuantos más miembros participen, mayor será la diversión y el sentido de comunidad compartida",0.0,0.0,0.0,,0.0
8,¿Qué incertidumbre hay sobre los vehículos eléctricos?,"Lo siento, pero no puedo responder a la pregunta basándome en el contexto proporcionado porque no se ha incluido ningún contexto.",[],"Si estos vehículos se convertirán en la principal opción de
transporte",0.0,0.0,0.0,,0.0
9,¿Por qué los vehículos eléctricos son una alternativa a los de combustión fósil?,"Lo siento, pero no puedo responder a la pregunta con la información proporcionada en el contexto de arriba.",[],Porque ofrecen la posibilidad de reducir las emisiones de gases de efecto invernadero y mitigar los impactos del cambio climático,0.0,0.0,1.0,,0.0
