,question,answer,contexts,ground_truth,context_relevancy,context_precision,context_recall,faithfulness,answer_relevancy
0,¿Qué beneficios para la salud tiene la cocina mediterránea?,"La cocina mediterránea se asocia con una serie de beneficios para la salud, incluyendo la prevención de enfermedades cardiovasculares y la promoción de un envejecimiento saludable.","['La cocina mediterránea, reconocida mundialmente por su saludable enfoque,\ndestaca por el empleo generoso de aceite de oliva virgen extra, una variedad de\nvegetales frescos y una amplia gama de productos naturales.'
 'las hierbas aromáticas y el pescado fresco, cada bocado es una celebración de la\nabundancia y la frescura de los ingredientes locales. La dieta mediterránea no solo\nes una delicia para el paladar, sino que también se ha asociado con una serie de'
 'Los sabores vibrantes y la simplicidad son el sello distintivo de la cocina\nmediterránea, donde los ingredientes de alta calidad se combinan con técnicas de\ncocción sencillas para realzar su sabor natural. Desde las olivas y los tomates hasta'
 'beneficios para la salud, desde la prevención de enfermedades cardiovasculares\nhasta la promoción de un envejecimiento saludable.\nHoy, la atención deportiva se centra en la emocionante semifinal de la Copa de']",Desde la prevención de enfermedades cardiovasculares hasta la promoción de un envejecimiento saludable.,0.14285714285714285,0.9999999999666667,1.0,1.0,0.9655851725637566
1,¿Cuál es el sello distintivo de la cocina mediterránea?,"El sello distintivo de la cocina mediterránea es la combinación de sabores vibrantes y la simplicidad, donde los ingredientes de alta calidad se combinan con técnicas de cocción sencillas para realzar su sabor natural.","['La cocina mediterránea, reconocida mundialmente por su saludable enfoque,\ndestaca por el empleo generoso de aceite de oliva virgen extra, una variedad de\nvegetales frescos y una amplia gama de productos naturales.'
 'Los sabores vibrantes y la simplicidad son el sello distintivo de la cocina\nmediterránea, donde los ingredientes de alta calidad se combinan con técnicas de\ncocción sencillas para realzar su sabor natural. Desde las olivas y los tomates hasta'
 'las hierbas aromáticas y el pescado fresco, cada bocado es una celebración de la\nabundancia y la frescura de los ingredientes locales. La dieta mediterránea no solo\nes una delicia para el paladar, sino que también se ha asociado con una serie de'
 '# Importancia de la Unidad Familiar\nLa importancia de la unidad familiar se destaca en la afirmación de que compartir\nuna comida fortalece los lazos afectivos. Cuando la familia se reúne en torno a la']",Los sabores vibrantes y la simplicidad,0.13333333333333333,0.9999999999666667,1.0,1.0,0.9999986978564533
2,¿Quién se enfrenta al Real Madrid?,El Real Madrid se enfrenta al Bayern de Múnich.,"['Europa, donde el prestigioso Real Madrid se enfrenta al poderoso Bayern de Múnich.\nEste encuentro promete una exhibición de talento y estrategia, mientras millones de\nfanáticos en todo el mundo esperan ansiosamente el desenlace.'
 'intensidad y emoción. Desde los hábiles pases hasta los impresionantes goles, cada\nmomento de este partido crucial llevará a los espectadores al borde de sus asientos,\nmientras el destino de ambos equipos pende de un hilo en esta emocionante'
 'La atmósfera eléctrica envuelve el estadio mientras los aficionados se preparan para\npresenciar un enfrentamiento legendario entre dos gigantes del fútbol europeo. Con\njugadores de clase mundial en ambos lados del campo, se espera un duelo lleno de'
 'semifinal de la Copa de Europa.\nEn el entorno de la estación espacial, surge un desafío significativo: la proliferación\nde bacterias que están experimentando mutaciones distintas a las observadas en']",El Bayern de Munich,0.21428571428571427,0.8333333332916666,1.0,1.0,0.9456492541363151
3,¿Qué se espera del partido?,"Se espera un duelo lleno de intensidad y emoción, con hábiles pases e impresionantes goles, llevando a los espectadores al borde de sus asientos. El encuentro entre el Real Madrid y el Bayern de Múnich promete ser una exhibición de talento y estrategia, con una atmósfera eléctrica en el estadio y jugadores de clase mundial en ambos lados del campo.","['intensidad y emoción. Desde los hábiles pases hasta los impresionantes goles, cada\nmomento de este partido crucial llevará a los espectadores al borde de sus asientos,\nmientras el destino de ambos equipos pende de un hilo en esta emocionante'
 'Europa, donde el prestigioso Real Madrid se enfrenta al poderoso Bayern de Múnich.\nEste encuentro promete una exhibición de talento y estrategia, mientras millones de\nfanáticos en todo el mundo esperan ansiosamente el desenlace.'
 'La atmósfera eléctrica envuelve el estadio mientras los aficionados se preparan para\npresenciar un enfrentamiento legendario entre dos gigantes del fútbol europeo. Con\njugadores de clase mundial en ambos lados del campo, se espera un duelo lleno de'
 'cuantos más miembros participen, mayor será la diversión y el sentido de\ncomunidad compartida. La familia extendida puede enriquecer aún más este\nambiente, proporcionando variedad de perspectivas y contribuciones a la\nconversación y la interacción.']",Un duelo lleno de intensidad y emoción,0.25,0.8333333332916666,1.0,1.0,0.8879112664531718
4,¿Cuál es el desafío relacionado con las bacterias en la estación espacial?,"El desafío relacionado con las bacterias en la estación espacial es su proliferación y las mutaciones inesperadas que experimentan, las cuales son distintas a las observadas en la Tierra. Este fenómeno plantea cuestionamientos sobre cómo la vida se adapta y evoluciona en condiciones extraterrestres y tiene implicaciones significativas para futuras misiones y la exploración interplanetaria.","['desafíos, y uno de los más intrigantes se manifiesta en la forma de bacterias que se\nadaptan y mutan de maneras inesperadas en el entorno único de una estación\nespacial. Estas mutaciones, diferentes a las que se observan en la Tierra, despiertan'
 'semifinal de la Copa de Europa.\nEn el entorno de la estación espacial, surge un desafío significativo: la proliferación\nde bacterias que están experimentando mutaciones distintas a las observadas en'
 'en el espacio y su posible impacto en futuras misiones y la exploración\ninterplanetaria.'
 'cuestionamientos profundos sobre cómo la vida se adapta y evoluciona en\ncondiciones extraterrestres. Este fenómeno plantea no solo preguntas científicas\nfundamentales, sino también dilemas éticos y prácticos sobre la gestión de la vida']",La proliferación de bacterias que están experimentando mutaciones distintas a las observadas en condiciones terrestres,0.23076923076923078,0.9166666666361111,1.0,1.0,1.0
5,¿Qué plantea el fenómeno de las mutaciones bacterianas?,"El fenómeno de las mutaciones bacterianas plantea cuestionamientos profundos sobre cómo la vida se adapta y evoluciona en condiciones extraterrestres, así como dilemas éticos y prácticos sobre la gestión de la vida en el espacio y su posible impacto en futuras misiones y la exploración interplanetaria.","['desafíos, y uno de los más intrigantes se manifiesta en la forma de bacterias que se\nadaptan y mutan de maneras inesperadas en el entorno único de una estación\nespacial. Estas mutaciones, diferentes a las que se observan en la Tierra, despiertan'
 'cuestionamientos profundos sobre cómo la vida se adapta y evoluciona en\ncondiciones extraterrestres. Este fenómeno plantea no solo preguntas científicas\nfundamentales, sino también dilemas éticos y prácticos sobre la gestión de la vida'
 'semifinal de la Copa de Europa.\nEn el entorno de la estación espacial, surge un desafío significativo: la proliferación\nde bacterias que están experimentando mutaciones distintas a las observadas en'
 'en el espacio y su posible impacto en futuras misiones y la exploración\ninterplanetaria.']","No solo preguntas científicas fundamentales, sino también dilemas éticos y prácticos sobre la gestión de la vida
en el espacio y su posible impacto en futuras misiones y la exploración interplanetaria.",0.15384615384615385,0.9999999999,1.0,1.0,0.9652882824240497
6,¿Cómo fortalece compartir una comida los lazos familiares?,"Compartir una comida fortalece los lazos familiares al fomentar la conexión emocional y cultivar momentos de alegría y camaradería. Cuando la familia se reúne en torno a la mesa, se promueve la unidad y se crean experiencias compartidas que enriquecen las relaciones afectivas entre los miembros.","['cuantos más miembros participen, mayor será la diversión y el sentido de\ncomunidad compartida. La familia extendida puede enriquecer aún más este\nambiente, proporcionando variedad de perspectivas y contribuciones a la\nconversación y la interacción.'
 '# Importancia de la Unidad Familiar\nLa importancia de la unidad familiar se destaca en la afirmación de que compartir\nuna comida fortalece los lazos afectivos. Cuando la familia se reúne en torno a la'
 'mesa, se fomenta la conexión emocional y se cultivan momentos de alegría y\ncamaradería.\n## La Dimensión de la Familia: Más es Mejor\nAdemás, la dimensión de la familia juega un papel crucial en esta dinámica, ya que'
 'La cocina mediterránea, reconocida mundialmente por su saludable enfoque,\ndestaca por el empleo generoso de aceite de oliva virgen extra, una variedad de\nvegetales frescos y una amplia gama de productos naturales.']",Fomentando la conexión emocional y se cultivan momentos de alegría y camaradería,0.3125,0.999999999975,1.0,1.0,0.9193629867612279
7,¿Por qué se destaca la participación de más miembros en las reuniones familiares?,"La participación de más miembros en las reuniones familiares se destaca porque cuantos más miembros participen, mayor será la diversión y el sentido de comunidad compartida. La familia extendida puede enriquecer el ambiente, proporcionando variedad de perspectivas y contribuciones a la conversación y la interacción, lo que fomenta la conexión emocional y cultiva momentos de alegría y camaradería.","['cuantos más miembros participen, mayor será la diversión y el sentido de\ncomunidad compartida. La familia extendida puede enriquecer aún más este\nambiente, proporcionando variedad de perspectivas y contribuciones a la\nconversación y la interacción.'
 'mesa, se fomenta la conexión emocional y se cultivan momentos de alegría y\ncamaradería.\n## La Dimensión de la Familia: Más es Mejor\nAdemás, la dimensión de la familia juega un papel crucial en esta dinámica, ya que'
 '# Importancia de la Unidad Familiar\nLa importancia de la unidad familiar se destaca en la afirmación de que compartir\nuna comida fortalece los lazos afectivos. Cuando la familia se reúne en torno a la'
 'La cocina mediterránea, reconocida mundialmente por su saludable enfoque,\ndestaca por el empleo generoso de aceite de oliva virgen extra, una variedad de\nvegetales frescos y una amplia gama de productos naturales.']","Porque cuantos más miembros participen, mayor será la diversión y el sentido de comunidad compartida",0.0,0.9999999999666667,1.0,1.0,0.9815543504365706
8,¿Qué incertidumbre hay sobre los vehículos eléctricos?,La incertidumbre sobre los vehículos eléctricos radica en si se convertirán en la principal opción de transporte.,"['futuro más sostenible y respetuoso con el medio ambiente. Sin embargo, persiste la\nincertidumbre sobre si estos vehículos se convertirán en la principal opción de\ntransporte.\n## La Promesa de la Sostenibilidad'
 'transporte.\n## La Promesa de la Sostenibilidad\nLos vehículos eléctricos representan una alternativa prometedora a los\ncombustibles fósiles, ofreciendo la posibilidad de reducir las emisiones de gases de'
 'conversación y la interacción.\n# El Futuro de los Vehículos Eléctricos: Perspectivas y Desafíos\nEl auge de los vehículos eléctricos se vislumbra como un paso significativo hacia un'
 'efecto invernadero y mitigar los impactos del cambio climático. Su funcionamiento\nsilencioso y eficiente también promete mejorar la calidad del aire en entornos\nurbanos, creando ciudades más habitables y saludables.']","Si estos vehículos se convertirán en la principal opción de
transporte",0.1875,0.9999999999,1.0,1.0,0.9793127176519739
9,¿Por qué los vehículos eléctricos son una alternativa a los de combustión fósil?,"Los vehículos eléctricos son una alternativa a los de combustión fósil porque ofrecen la posibilidad de reducir las emisiones de gases de efecto invernadero y mitigar los impactos del cambio climático. Además, su funcionamiento silencioso y eficiente promete mejorar la calidad del aire en entornos urbanos, creando ciudades más habitables y saludables.","['transporte.\n## La Promesa de la Sostenibilidad\nLos vehículos eléctricos representan una alternativa prometedora a los\ncombustibles fósiles, ofreciendo la posibilidad de reducir las emisiones de gases de'
 'futuro más sostenible y respetuoso con el medio ambiente. Sin embargo, persiste la\nincertidumbre sobre si estos vehículos se convertirán en la principal opción de\ntransporte.\n## La Promesa de la Sostenibilidad'
 'efecto invernadero y mitigar los impactos del cambio climático. Su funcionamiento\nsilencioso y eficiente también promete mejorar la calidad del aire en entornos\nurbanos, creando ciudades más habitables y saludables.'
 'conversación y la interacción.\n# El Futuro de los Vehículos Eléctricos: Perspectivas y Desafíos\nEl auge de los vehículos eléctricos se vislumbra como un paso significativo hacia un']",Porque ofrecen la posibilidad de reducir las emisiones de gases de efecto invernadero y mitigar los impactos del cambio climático,0.125,0.999999999975,1.0,1.0,0.9469264890102872
