,question,answer,contexts,ground_truth,context_relevancy,context_precision,context_recall,faithfulness,answer_relevancy
0,¿Qué beneficios para la salud tiene la cocina mediterránea?,"La cocina mediterránea se ha asociado con una serie de beneficios para la salud, incluyendo la prevención de enfermedades cardiovasculares y la promoción de un envejecimiento saludable.","['La dieta mediterránea no solo\nes una delicia para el paladar, sino que también se ha asociado con una serie de\nbeneficios para la salud, desde la prevención de enfermedades cardiovasculares\nhasta la promoción de un envejecimiento saludable. Hoy, la atención deportiva se centra en la emocionante semifinal de la Copa de\nEuropa, donde el prestigioso Real Madrid se enfrenta al poderoso Bayern de Múnich.'
 'La cocina mediterránea, reconocida mundialmente por su saludable enfoque,\ndestaca por el empleo generoso de aceite de oliva virgen extra, una variedad de\nvegetales frescos y una amplia gama de productos naturales. Los sabores vibrantes y la simplicidad son el sello distintivo de la cocina\nmediterránea, donde los ingredientes de alta calidad se combinan con técnicas de\ncocción sencillas para realzar su sabor natural.'
 'Desde las olivas y los tomates hasta\nlas hierbas aromáticas y el pescado fresco, cada bocado es una celebración de la\nabundancia y la frescura de los ingredientes locales.'
 '# Importancia de la Unidad Familiar\nLa importancia de la unidad familiar se destaca en la afirmación de que compartir\nuna comida fortalece los lazos afectivos. Cuando la familia se reúne en torno a la\nmesa, se fomenta la conexión emocional y se cultivan momentos de alegría y\ncamaradería. ## La Dimensión de la Familia: Más es Mejor\nAdemás, la dimensión de la familia juega un papel crucial en esta dinámica, ya que\ncuantos más miembros participen, mayor será la diversión y el sentido de\ncomunidad compartida.']",Desde la prevención de enfermedades cardiovasculares hasta la promoción de un envejecimiento saludable.,0.12,0.9999999999666667,1.0,1.0,0.982010912191401
1,¿Cuál es el sello distintivo de la cocina mediterránea?,"El sello distintivo de la cocina mediterránea es la simplicidad y los sabores vibrantes, donde los ingredientes de alta calidad se combinan con técnicas de cocción sencillas para realzar su sabor natural.","['La cocina mediterránea, reconocida mundialmente por su saludable enfoque,\ndestaca por el empleo generoso de aceite de oliva virgen extra, una variedad de\nvegetales frescos y una amplia gama de productos naturales. Los sabores vibrantes y la simplicidad son el sello distintivo de la cocina\nmediterránea, donde los ingredientes de alta calidad se combinan con técnicas de\ncocción sencillas para realzar su sabor natural.'
 'Desde las olivas y los tomates hasta\nlas hierbas aromáticas y el pescado fresco, cada bocado es una celebración de la\nabundancia y la frescura de los ingredientes locales.'
 'La dieta mediterránea no solo\nes una delicia para el paladar, sino que también se ha asociado con una serie de\nbeneficios para la salud, desde la prevención de enfermedades cardiovasculares\nhasta la promoción de un envejecimiento saludable. Hoy, la atención deportiva se centra en la emocionante semifinal de la Copa de\nEuropa, donde el prestigioso Real Madrid se enfrenta al poderoso Bayern de Múnich.'
 '# Importancia de la Unidad Familiar\nLa importancia de la unidad familiar se destaca en la afirmación de que compartir\nuna comida fortalece los lazos afectivos. Cuando la familia se reúne en torno a la\nmesa, se fomenta la conexión emocional y se cultivan momentos de alegría y\ncamaradería. ## La Dimensión de la Familia: Más es Mejor\nAdemás, la dimensión de la familia juega un papel crucial en esta dinámica, ya que\ncuantos más miembros participen, mayor será la diversión y el sentido de\ncomunidad compartida.']",Los sabores vibrantes y la simplicidad,0.16,0.99999999995,1.0,1.0,0.9999999999999997
2,¿Quién se enfrenta al Real Madrid?,El Real Madrid se enfrenta al Bayern de Múnich.,"['Este encuentro promete una exhibición de talento y estrategia, mientras millones de\nfanáticos en todo el mundo esperan ansiosamente el desenlace.'
 'La atmósfera eléctrica envuelve el estadio mientras los aficionados se preparan para\npresenciar un enfrentamiento legendario entre dos gigantes del fútbol europeo. Con\njugadores de clase mundial en ambos lados del campo, se espera un duelo lleno de\nintensidad y emoción.'
 'Desde los hábiles pases hasta los impresionantes goles, cada\nmomento de este partido crucial llevará a los espectadores al borde de sus asientos,\nmientras el destino de ambos equipos pende de un hilo en esta emocionante\nsemifinal de la Copa de Europa.'
 'La dieta mediterránea no solo\nes una delicia para el paladar, sino que también se ha asociado con una serie de\nbeneficios para la salud, desde la prevención de enfermedades cardiovasculares\nhasta la promoción de un envejecimiento saludable. Hoy, la atención deportiva se centra en la emocionante semifinal de la Copa de\nEuropa, donde el prestigioso Real Madrid se enfrenta al poderoso Bayern de Múnich.']",El Bayern de Munich,0.058823529411764705,0.249999999975,1.0,1.0,0.9515595453468286
3,¿Qué se espera del partido?,"Se espera un duelo lleno de intensidad y emoción, con una exhibición de talento y estrategia, hábiles pases e impresionantes goles, llevando a los espectadores al borde de sus asientos en esta emocionante semifinal de la Copa de Europa.","['Este encuentro promete una exhibición de talento y estrategia, mientras millones de\nfanáticos en todo el mundo esperan ansiosamente el desenlace.'
 'Desde los hábiles pases hasta los impresionantes goles, cada\nmomento de este partido crucial llevará a los espectadores al borde de sus asientos,\nmientras el destino de ambos equipos pende de un hilo en esta emocionante\nsemifinal de la Copa de Europa.'
 'La atmósfera eléctrica envuelve el estadio mientras los aficionados se preparan para\npresenciar un enfrentamiento legendario entre dos gigantes del fútbol europeo. Con\njugadores de clase mundial en ambos lados del campo, se espera un duelo lleno de\nintensidad y emoción.'
 'La familia extendida puede enriquecer aún más este\nambiente, proporcionando variedad de perspectivas y contribuciones a la\nconversación y la interacción.']",Un duelo lleno de intensidad y emoción,0.0,0.9999999999666667,1.0,1.0,0.910342629061967
4,¿Cuál es el desafío relacionado con las bacterias en la estación espacial?,"El desafío relacionado con las bacterias en la estación espacial es la proliferación de bacterias que están experimentando mutaciones distintas a las observadas en condiciones terrestres. Esto plantea interrogantes sobre su comportamiento y adaptación en entornos extraterrestres, así como dilemas éticos y prácticos sobre la gestión de la vida en el espacio y su posible impacto en futuras misiones y la exploración interplanetaria.","['En el entorno de la estación espacial, surge un desafío significativo: la proliferación\nde bacterias que están experimentando mutaciones distintas a las observadas en\ncondiciones terrestres, planteando interrogantes sobre su comportamiento y\nadaptación en entornos extraterrestres.'
 'La expansión del conocimiento humano hacia el espacio exterior no está exenta de\ndesafíos, y uno de los más intrigantes se manifiesta en la forma de bacterias que se\nadaptan y mutan de maneras inesperadas en el entorno único de una estación\nespacial. Estas mutaciones, diferentes a las que se observan en la Tierra, despiertan\ncuestionamientos profundos sobre cómo la vida se adapta y evoluciona en\ncondiciones extraterrestres.'
 'Este fenómeno plantea no solo preguntas científicas\nfundamentales, sino también dilemas éticos y prácticos sobre la gestión de la vida\nen el espacio y su posible impacto en futuras misiones y la exploración\ninterplanetaria.'
 'Sin embargo, persiste la\nincertidumbre sobre si estos vehículos se convertirán en la principal opción de\ntransporte.']",La proliferación de bacterias que están experimentando mutaciones distintas a las observadas en condiciones terrestres,0.16666666666666666,0.999999999975,1.0,1.0,1.0
5,¿Qué plantea el fenómeno de las mutaciones bacterianas?,"El fenómeno de las mutaciones bacterianas en el entorno de la estación espacial plantea interrogantes sobre su comportamiento y adaptación en entornos extraterrestres, cuestiones científicas fundamentales sobre cómo la vida se adapta y evoluciona en condiciones extraterrestres, y dilemas éticos y prácticos sobre la gestión de la vida en el espacio y su posible impacto en futuras misiones y la exploración interplanetaria.","['En el entorno de la estación espacial, surge un desafío significativo: la proliferación\nde bacterias que están experimentando mutaciones distintas a las observadas en\ncondiciones terrestres, planteando interrogantes sobre su comportamiento y\nadaptación en entornos extraterrestres.'
 'La expansión del conocimiento humano hacia el espacio exterior no está exenta de\ndesafíos, y uno de los más intrigantes se manifiesta en la forma de bacterias que se\nadaptan y mutan de maneras inesperadas en el entorno único de una estación\nespacial. Estas mutaciones, diferentes a las que se observan en la Tierra, despiertan\ncuestionamientos profundos sobre cómo la vida se adapta y evoluciona en\ncondiciones extraterrestres.'
 'Este fenómeno plantea no solo preguntas científicas\nfundamentales, sino también dilemas éticos y prácticos sobre la gestión de la vida\nen el espacio y su posible impacto en futuras misiones y la exploración\ninterplanetaria.'
 'La familia extendida puede enriquecer aún más este\nambiente, proporcionando variedad de perspectivas y contribuciones a la\nconversación y la interacción.']","No solo preguntas científicas fundamentales, sino también dilemas éticos y prácticos sobre la gestión de la vida
en el espacio y su posible impacto en futuras misiones y la exploración interplanetaria.",0.16666666666666666,0.9999999999666667,1.0,1.0,0.9533351956922235
6,¿Cómo fortalece compartir una comida los lazos familiares?,Compartir una comida fortalece los lazos familiares al fomentar la conexión emocional y cultivar momentos de alegría y camaradería cuando la familia se reúne en torno a la mesa.,"['# Importancia de la Unidad Familiar\nLa importancia de la unidad familiar se destaca en la afirmación de que compartir\nuna comida fortalece los lazos afectivos. Cuando la familia se reúne en torno a la\nmesa, se fomenta la conexión emocional y se cultivan momentos de alegría y\ncamaradería. ## La Dimensión de la Familia: Más es Mejor\nAdemás, la dimensión de la familia juega un papel crucial en esta dinámica, ya que\ncuantos más miembros participen, mayor será la diversión y el sentido de\ncomunidad compartida.'
 'La familia extendida puede enriquecer aún más este\nambiente, proporcionando variedad de perspectivas y contribuciones a la\nconversación y la interacción.'
 'Desde las olivas y los tomates hasta\nlas hierbas aromáticas y el pescado fresco, cada bocado es una celebración de la\nabundancia y la frescura de los ingredientes locales.'
 'La dieta mediterránea no solo\nes una delicia para el paladar, sino que también se ha asociado con una serie de\nbeneficios para la salud, desde la prevención de enfermedades cardiovasculares\nhasta la promoción de un envejecimiento saludable. Hoy, la atención deportiva se centra en la emocionante semifinal de la Copa de\nEuropa, donde el prestigioso Real Madrid se enfrenta al poderoso Bayern de Múnich.']",Fomentando la conexión emocional y se cultivan momentos de alegría y camaradería,0.0,0.8055555555287036,1.0,1.0,0.921761401030456
7,¿Por qué se destaca la participación de más miembros en las reuniones familiares?,"La participación de más miembros en las reuniones familiares se destaca porque, según el contexto proporcionado, cuantos más miembros participen, mayor será la diversión y el sentido de comunidad compartida. Además, la familia extendida puede enriquecer aún más este ambiente, proporcionando variedad de perspectivas y contribuciones a la conversación y la interacción.","['La familia extendida puede enriquecer aún más este\nambiente, proporcionando variedad de perspectivas y contribuciones a la\nconversación y la interacción.'
 '# Importancia de la Unidad Familiar\nLa importancia de la unidad familiar se destaca en la afirmación de que compartir\nuna comida fortalece los lazos afectivos. Cuando la familia se reúne en torno a la\nmesa, se fomenta la conexión emocional y se cultivan momentos de alegría y\ncamaradería. ## La Dimensión de la Familia: Más es Mejor\nAdemás, la dimensión de la familia juega un papel crucial en esta dinámica, ya que\ncuantos más miembros participen, mayor será la diversión y el sentido de\ncomunidad compartida.'
 'Este encuentro promete una exhibición de talento y estrategia, mientras millones de\nfanáticos en todo el mundo esperan ansiosamente el desenlace.'
 'Desde las olivas y los tomates hasta\nlas hierbas aromáticas y el pescado fresco, cada bocado es una celebración de la\nabundancia y la frescura de los ingredientes locales.']","Porque cuantos más miembros participen, mayor será la diversión y el sentido de comunidad compartida",0.05555555555555555,0.99999999995,1.0,1.0,0.9765655259623814
8,¿Qué incertidumbre hay sobre los vehículos eléctricos?,La incertidumbre sobre los vehículos eléctricos es si se convertirán en la principal opción de transporte.,"['Sin embargo, persiste la\nincertidumbre sobre si estos vehículos se convertirán en la principal opción de\ntransporte.'
 '# El Futuro de los Vehículos Eléctricos: Perspectivas y Desafíos\nEl auge de los vehículos eléctricos se vislumbra como un paso significativo hacia un\nfuturo más sostenible y respetuoso con el medio ambiente.'
 '## La Promesa de la Sostenibilidad\nLos vehículos eléctricos representan una alternativa prometedora a los\ncombustibles fósiles, ofreciendo la posibilidad de reducir las emisiones de gases de\nefecto invernadero y mitigar los impactos del cambio climático. Su funcionamiento\nsilencioso y eficiente también promete mejorar la calidad del aire en entornos\nurbanos, creando ciudades más habitables y saludables.'
 'La atmósfera eléctrica envuelve el estadio mientras los aficionados se preparan para\npresenciar un enfrentamiento legendario entre dos gigantes del fútbol europeo. Con\njugadores de clase mundial en ambos lados del campo, se espera un duelo lleno de\nintensidad y emoción.']","Si estos vehículos se convertirán en la principal opción de
transporte",0.0,0.9999999999,1.0,1.0,0.9937200879003932
9,¿Por qué los vehículos eléctricos son una alternativa a los de combustión fósil?,"Los vehículos eléctricos son una alternativa a los de combustión fósil porque ofrecen la posibilidad de reducir las emisiones de gases de efecto invernadero y mitigar los impactos del cambio climático. Además, su funcionamiento silencioso y eficiente promete mejorar la calidad del aire en entornos urbanos, creando ciudades más habitables y saludables.","['## La Promesa de la Sostenibilidad\nLos vehículos eléctricos representan una alternativa prometedora a los\ncombustibles fósiles, ofreciendo la posibilidad de reducir las emisiones de gases de\nefecto invernadero y mitigar los impactos del cambio climático. Su funcionamiento\nsilencioso y eficiente también promete mejorar la calidad del aire en entornos\nurbanos, creando ciudades más habitables y saludables.'
 '# El Futuro de los Vehículos Eléctricos: Perspectivas y Desafíos\nEl auge de los vehículos eléctricos se vislumbra como un paso significativo hacia un\nfuturo más sostenible y respetuoso con el medio ambiente.'
 'Sin embargo, persiste la\nincertidumbre sobre si estos vehículos se convertirán en la principal opción de\ntransporte.'
 'La atmósfera eléctrica envuelve el estadio mientras los aficionados se preparan para\npresenciar un enfrentamiento legendario entre dos gigantes del fútbol europeo. Con\njugadores de clase mundial en ambos lados del campo, se espera un duelo lleno de\nintensidad y emoción.']",Porque ofrecen la posibilidad de reducir las emisiones de gases de efecto invernadero y mitigar los impactos del cambio climático,0.2222222222222222,0.9999999999666667,1.0,1.0,0.9876527085942054
