,question,answer,contexts,ground_truth,context_relevancy,context_precision,context_recall,faithfulness,answer_relevancy
0,¿Qué beneficios para la salud tiene la cocina mediterránea?,"La cocina mediterránea se ha asociado con una serie de beneficios para la salud, incluyendo la prevención de enfermedades cardiovasculares y la promoción de un envejecimiento saludable.","['La dieta mediterránea no solo es una delicia para el paladar, sino que también se ha asociado con una serie de beneficios para la salud, desde la prevención de enfermedades cardiovasculares hasta la promoción de un envejecimiento saludable.'
 'La cocina mediterránea, reconocida mundialmente por su saludable enfoque, destaca por el empleo generoso de aceite de oliva virgen extra, una variedad de vegetales frescos y una amplia gama de productos naturales.'
 'Los sabores vibrantes y la simplicidad son el sello distintivo de la cocina mediterránea, donde los ingredientes de alta calidad se combinan con técnicas de cocción sencillas para realzar su sabor natural.'
 'Desde las olivas y los tomates hasta las hierbas aromáticas y el pescado fresco, cada bocado es una celebración de la abundancia y la frescura de los ingredientes locales.']",Desde la prevención de enfermedades cardiovasculares hasta la promoción de un envejecimiento saludable.,0.5,0.999999999975,1.0,1.0,0.982010912191401
1,¿Cuál es el sello distintivo de la cocina mediterránea?,"El sello distintivo de la cocina mediterránea son los sabores vibrantes y la simplicidad, donde los ingredientes de alta calidad se combinan con técnicas de cocción sencillas para realzar su sabor natural.","['Los sabores vibrantes y la simplicidad son el sello distintivo de la cocina mediterránea, donde los ingredientes de alta calidad se combinan con técnicas de cocción sencillas para realzar su sabor natural.'
 'La cocina mediterránea, reconocida mundialmente por su saludable enfoque, destaca por el empleo generoso de aceite de oliva virgen extra, una variedad de vegetales frescos y una amplia gama de productos naturales.'
 'Desde las olivas y los tomates hasta las hierbas aromáticas y el pescado fresco, cada bocado es una celebración de la abundancia y la frescura de los ingredientes locales.'
 'La dieta mediterránea no solo es una delicia para el paladar, sino que también se ha asociado con una serie de beneficios para la salud, desde la prevención de enfermedades cardiovasculares hasta la promoción de un envejecimiento saludable.']",Los sabores vibrantes y la simplicidad,1.0,0.999999999975,1.0,1.0,0.9999999999999997
2,¿Quién se enfrenta al Real Madrid?,El Real Madrid se enfrenta al Bayern de Múnich.,"['Hoy, la atención deportiva se centra en la emocionante semifinal de la Copa de Europa, donde el prestigioso Real Madrid se enfrenta al poderoso Bayern de Múnich.'
 'Con jugadores de clase mundial en ambos lados del campo, se espera un duelo lleno de intensidad y emoción.'
 'La atmósfera eléctrica envuelve el estadio mientras los aficionados se preparan para presenciar un enfrentamiento legendario entre dos gigantes del fútbol europeo.'
 'Este encuentro promete una exhibición de talento y estrategia, mientras millones de fanáticos en todo el mundo esperan ansiosamente el desenlace.']",El Bayern de Munich,0.25,0.9999999999,1.0,1.0,0.9515390360813916
3,¿Qué se espera del partido?,"Se espera un partido lleno de intensidad, emoción y talento, con una exhibición de estrategias y habilidades que mantendrán a los espectadores al borde de sus asientos. La atmósfera será eléctrica mientras los aficionados presencian un enfrentamiento legendario entre dos gigantes del fútbol europeo en la emocionante semifinal de la Copa de Europa.","['Con jugadores de clase mundial en ambos lados del campo, se espera un duelo lleno de intensidad y emoción.'
 'Este encuentro promete una exhibición de talento y estrategia, mientras millones de fanáticos en todo el mundo esperan ansiosamente el desenlace.'
 'Desde los hábiles pases hasta los impresionantes goles, cada momento de este partido crucial llevará a los espectadores al borde de sus asientos, mientras el destino de ambos equipos pende de un hilo en esta emocionante semifinal de la Copa de Europa.'
 'La atmósfera eléctrica envuelve el estadio mientras los aficionados se preparan para presenciar un enfrentamiento legendario entre dos gigantes del fútbol europeo.']",Un duelo lleno de intensidad y emoción,1.0,0.9999999999666667,1.0,1.0,0.9357505210795876
4,¿Cuál es el desafío relacionado con las bacterias en la estación espacial?,"El desafío relacionado con las bacterias en la estación espacial es la proliferación de bacterias que están experimentando mutaciones distintas a las observadas en condiciones terrestres, lo cual plantea interrogantes sobre su comportamiento, adaptación en entornos extraterrestres, y su posible impacto en futuras misiones y la exploración interplanetaria.","['En el entorno de la estación espacial, surge un desafío significativo: la proliferación de bacterias que están experimentando mutaciones distintas a las observadas en condiciones terrestres, planteando interrogantes sobre su comportamiento y adaptación en entornos extraterrestres.'
 'La expansión del conocimiento humano hacia el espacio exterior no está exenta de desafíos, y uno de los más intrigantes se manifiesta en la forma de bacterias que se adaptan y mutan de maneras inesperadas en el entorno único de una estación espacial.'
 'Este fenómeno plantea no solo preguntas científicas fundamentales, sino también dilemas éticos y prácticos sobre la gestión de la vida en el espacio y su posible impacto en futuras misiones y la exploración interplanetaria.'
 'Estas mutaciones, diferentes a las que se observan en la Tierra, despiertan cuestionamientos profundos sobre cómo la vida se adapta y evoluciona en condiciones extraterrestres.']",La proliferación de bacterias que están experimentando mutaciones distintas a las observadas en condiciones terrestres,0.5,0.999999999975,1.0,1.0,1.0
5,¿Qué plantea el fenómeno de las mutaciones bacterianas?,"El fenómeno de las mutaciones bacterianas plantea interrogantes sobre el comportamiento y adaptación de la vida en entornos extraterrestres, cuestionamientos profundos sobre cómo la vida se adapta y evoluciona en condiciones diferentes a las terrestres, y dilemas éticos y prácticos sobre la gestión de la vida en el espacio y su posible impacto en futuras misiones y la exploración interplanetaria.","['En el entorno de la estación espacial, surge un desafío significativo: la proliferación de bacterias que están experimentando mutaciones distintas a las observadas en condiciones terrestres, planteando interrogantes sobre su comportamiento y adaptación en entornos extraterrestres.'
 'Estas mutaciones, diferentes a las que se observan en la Tierra, despiertan cuestionamientos profundos sobre cómo la vida se adapta y evoluciona en condiciones extraterrestres.'
 'La expansión del conocimiento humano hacia el espacio exterior no está exenta de desafíos, y uno de los más intrigantes se manifiesta en la forma de bacterias que se adaptan y mutan de maneras inesperadas en el entorno único de una estación espacial.'
 'Este fenómeno plantea no solo preguntas científicas fundamentales, sino también dilemas éticos y prácticos sobre la gestión de la vida en el espacio y su posible impacto en futuras misiones y la exploración interplanetaria.']","No solo preguntas científicas fundamentales, sino también dilemas éticos y prácticos sobre la gestión de la vida
en el espacio y su posible impacto en futuras misiones y la exploración interplanetaria.",0.75,0.8055555555287036,1.0,1.0,1.0000000000000002
6,¿Cómo fortalece compartir una comida los lazos familiares?,"Compartir una comida fortalece los lazos familiares al fomentar la conexión emocional, cultivar momentos de alegría y camaradería, y proporcionar un ambiente enriquecido con diversas perspectivas y contribuciones de la familia extendida. La participación de más miembros en la comida aumenta la diversión y el sentido de comunidad compartida.","['La importancia de la unidad familiar se destaca en la afirmación de que compartir una comida fortalece los lazos afectivos.'
 'Cuando la familia se reúne en torno a la mesa, se fomenta la conexión emocional y se cultivan momentos de alegría y camaradería.'
 'La familia extendida puede enriquecer aún más este ambiente, proporcionando variedad de perspectivas y contribuciones a la conversación y la interacción.'
 'Además, la dimensión de la familia juega un papel crucial en esta dinámica, ya que cuantos más miembros participen, mayor será la diversión y el sentido de comunidad compartida.']",Fomentando la conexión emocional y se cultivan momentos de alegría y camaradería,1.0,0.9166666666361111,1.0,1.0,0.9644757086989665
7,¿Por qué se destaca la participación de más miembros en las reuniones familiares?,"La participación de más miembros en las reuniones familiares se destaca porque cuantos más miembros participen, mayor será la diversión y el sentido de comunidad compartida, lo que enriquece el ambiente proporcionando variedad de perspectivas y contribuciones a la conversación y la interacción, además de fomentar la conexión emocional y cultivar momentos de alegría y camaradería.","['Además, la dimensión de la familia juega un papel crucial en esta dinámica, ya que cuantos más miembros participen, mayor será la diversión y el sentido de comunidad compartida.'
 'La familia extendida puede enriquecer aún más este ambiente, proporcionando variedad de perspectivas y contribuciones a la conversación y la interacción.'
 'Cuando la familia se reúne en torno a la mesa, se fomenta la conexión emocional y se cultivan momentos de alegría y camaradería.'
 'La importancia de la unidad familiar se destaca en la afirmación de que compartir una comida fortalece los lazos afectivos.']","Porque cuantos más miembros participen, mayor será la diversión y el sentido de comunidad compartida",1.0,0.9999999999666667,1.0,1.0,0.9999999999999991
8,¿Qué incertidumbre hay sobre los vehículos eléctricos?,La incertidumbre sobre los vehículos eléctricos radica en si se convertirán en la principal opción de transporte.,"['Sin embargo, persiste la incertidumbre sobre si estos vehículos se convertirán en la principal opción de transporte.'
 'Los vehículos eléctricos representan una alternativa prometedora a los combustibles fósiles, ofreciendo la posibilidad de reducir las emisiones de gases de efecto invernadero y mitigar los impactos del cambio climático.'
 'El auge de los vehículos eléctricos se vislumbra como un paso significativo hacia un futuro más sostenible y respetuoso con el medio ambiente.'
 '# El Futuro de los Vehículos Eléctricos: Perspectivas y Desafíos']","Si estos vehículos se convertirán en la principal opción de
transporte",0.25,0.99999999995,1.0,1.0,0.9793127176519739
9,¿Por qué los vehículos eléctricos son una alternativa a los de combustión fósil?,Los vehículos eléctricos son una alternativa a los de combustión fósil porque ofrecen la posibilidad de reducir las emisiones de gases de efecto invernadero y mitigar los impactos del cambio climático.,"['Los vehículos eléctricos representan una alternativa prometedora a los combustibles fósiles, ofreciendo la posibilidad de reducir las emisiones de gases de efecto invernadero y mitigar los impactos del cambio climático.'
 'El auge de los vehículos eléctricos se vislumbra como un paso significativo hacia un futuro más sostenible y respetuoso con el medio ambiente.'
 '# El Futuro de los Vehículos Eléctricos: Perspectivas y Desafíos'
 'Sin embargo, persiste la incertidumbre sobre si estos vehículos se convertirán en la principal opción de transporte.']",Porque ofrecen la posibilidad de reducir las emisiones de gases de efecto invernadero y mitigar los impactos del cambio climático,0.5,0.999999999975,1.0,1.0,0.0
