,question,answer,contexts,ground_truth,context_relevancy,context_precision,context_recall,faithfulness,answer_relevancy
0,¿Qué beneficios para la salud tiene la cocina mediterránea?,"Lo siento, pero no puedo responder a la pregunta con el contexto proporcionado ya que no se incluyó ningún contexto específico. ¿Podrías proporcionar el contexto necesario para que pueda ayudarte mejor?",[],Desde la prevención de enfermedades cardiovasculares hasta la promoción de un envejecimiento saludable.,0.0,0.0,1.0,,0.0
1,¿Cuál es el sello distintivo de la cocina mediterránea?,"El sello distintivo de la cocina mediterránea es la combinación de sabores vibrantes y la simplicidad, donde los ingredientes de alta calidad se combinan con técnicas de cocción sencillas para realzar su sabor natural.","['La cocina mediterránea, reconocida mundialmente por su saludable enfoque,\ndestaca por el empleo generoso de aceite de oliva virgen extra, una variedad de\nvegetales frescos y una amplia gama de productos naturales. Los sabores vibrantes y la simplicidad son el sello distintivo de la cocina\nmediterránea, donde los ingredientes de alta calidad se combinan con técnicas de\ncocción sencillas para realzar su sabor natural.']",Los sabores vibrantes y la simplicidad,0.16666666666666666,0.9999999999,1.0,1.0,0.9999999999999997
2,¿Quién se enfrenta al Real Madrid?,El Real Madrid se enfrenta al Bayern de Múnich.,"['La dieta mediterránea no solo\nes una delicia para el paladar, sino que también se ha asociado con una serie de\nbeneficios para la salud, desde la prevención de enfermedades cardiovasculares\nhasta la promoción de un envejecimiento saludable. Hoy, la atención deportiva se centra en la emocionante semifinal de la Copa de\nEuropa, donde el prestigioso Real Madrid se enfrenta al poderoso Bayern de Múnich.']",El Bayern de Munich,0.16666666666666666,0.9999999999,1.0,1.0,0.9633909917011453
3,¿Qué se espera del partido?,"Se espera que el partido sea emocionante y mantenga a los espectadores al borde de sus asientos debido a los hábiles pases y los impresionantes goles, ya que es una semifinal crucial de la Copa de Europa y el destino de ambos equipos está en juego.","['Desde los hábiles pases hasta los impresionantes goles, cada\nmomento de este partido crucial llevará a los espectadores al borde de sus asientos,\nmientras el destino de ambos equipos pende de un hilo en esta emocionante\nsemifinal de la Copa de Europa. En el entorno de la estación espacial, surge un desafío significativo: la proliferación\nde bacterias que están experimentando mutaciones distintas a las observadas en\ncondiciones terrestres, planteando interrogantes sobre su comportamiento y\nadaptación en entornos extraterrestres.']",Un duelo lleno de intensidad y emoción,0.0,0.0,1.0,1.0,0.9511667090416838
4,¿Cuál es el desafío relacionado con las bacterias en la estación espacial?,"No se proporciona ningún contexto específico en el texto proporcionado. Por lo tanto, no puedo responder a la pregunta sobre el desafío relacionado con las bacterias en la estación espacial basándome en el contexto de arriba.",[],La proliferación de bacterias que están experimentando mutaciones distintas a las observadas en condiciones terrestres,0.0,0.0,0.0,,0.0
5,¿Qué plantea el fenómeno de las mutaciones bacterianas?,El fenómeno de las mutaciones bacterianas plantea cambios genéticos en las bacterias.,[],"No solo preguntas científicas fundamentales, sino también dilemas éticos y prácticos sobre la gestión de la vida
en el espacio y su posible impacto en futuras misiones y la exploración interplanetaria.",0.0,0.0,1.0,1.0,1.0000000000000002
6,¿Cómo fortalece compartir una comida los lazos familiares?,El contexto no proporciona información específica sobre cómo compartir una comida fortalece los lazos familiares.,[],Fomentando la conexión emocional y se cultivan momentos de alegría y camaradería,0.0,0.0,0.5,,0.0
7,¿Por qué se destaca la participación de más miembros en las reuniones familiares?,"Lo siento, pero no hay suficiente información en el contexto proporcionado para responder a la pregunta sobre por qué se destaca la participación de más miembros en las reuniones familiares.",[],"Porque cuantos más miembros participen, mayor será la diversión y el sentido de comunidad compartida",0.0,0.0,0.0,,0.0
8,¿Qué incertidumbre hay sobre los vehículos eléctricos?,"Lo siento, pero no puedo responder a la pregunta ya que no has proporcionado ningún contexto para basar mi respuesta. ¿Podrías proporcionar el contexto necesario?",[],"Si estos vehículos se convertirán en la principal opción de
transporte",0.0,0.0,0.0,,0.0
9,¿Por qué los vehículos eléctricos son una alternativa a los de combustión fósil?,"Lo siento, no puedo responder a la pregunta basándome en el contexto proporcionado porque no se ha incluido ningún contexto en el mensaje. Por favor, proporciona el contexto necesario para que pueda darte una respuesta adecuada.",[],Porque ofrecen la posibilidad de reducir las emisiones de gases de efecto invernadero y mitigar los impactos del cambio climático,0.0,0.0,1.0,,0.0
