,question,answer,contexts,ground_truth,context_relevancy,context_precision,context_recall,faithfulness,answer_relevancy
0,¿Qué beneficios para la salud tiene la cocina mediterránea?,"La cocina mediterránea tiene una serie de beneficios para la salud, incluyendo la prevención de enfermedades cardiovasculares y la promoción de un envejecimiento saludable.","['La cocina mediterránea, reconocida mundialmente por su saludable enfoque,\ndestaca por el empleo generoso de aceite de oliva virgen extra, una variedad de\nvegetales frescos y una amplia gama de productos naturales. Los sabores vibrantes y la simplicidad son el sello distintivo de la cocina\nmediterránea, donde los ingredientes de alta calidad se combinan con técnicas de\ncocción sencillas para realzar su sabor natural.'
 'La dieta mediterránea no solo\nes una delicia para el paladar, sino que también se ha asociado con una serie de\nbeneficios para la salud, desde la prevención de enfermedades cardiovasculares\nhasta la promoción de un envejecimiento saludable. Hoy, la atención deportiva se centra en la emocionante semifinal de la Copa de\nEuropa, donde el prestigioso Real Madrid se enfrenta al poderoso Bayern de Múnich.'
 '']",Desde la prevención de enfermedades cardiovasculares hasta la promoción de un envejecimiento saludable.,0.08333333333333333,0.99999999995,1.0,1.0,0.9999999999999994
1,¿Cuál es el sello distintivo de la cocina mediterránea?,"El sello distintivo de la cocina mediterránea es el uso de sabores vibrantes y la simplicidad, donde los ingredientes de alta calidad se combinan con técnicas de cocción sencillas para realzar su sabor natural.","['La cocina mediterránea, reconocida mundialmente por su saludable enfoque,\ndestaca por el empleo generoso de aceite de oliva virgen extra, una variedad de\nvegetales frescos y una amplia gama de productos naturales. Los sabores vibrantes y la simplicidad son el sello distintivo de la cocina\nmediterránea, donde los ingredientes de alta calidad se combinan con técnicas de\ncocción sencillas para realzar su sabor natural.'
 'Este encuentro promete una exhibición de talento y estrategia, mientras millones de\nfanáticos en todo el mundo esperan ansiosamente el desenlace.'
 '']",Los sabores vibrantes y la simplicidad,0.25,0.9999999999,1.0,1.0,1.0000000000000002
2,¿Quién se enfrenta al Real Madrid?,El Real Madrid se enfrenta al Bayern de Múnich.,"['La dieta mediterránea no solo\nes una delicia para el paladar, sino que también se ha asociado con una serie de\nbeneficios para la salud, desde la prevención de enfermedades cardiovasculares\nhasta la promoción de un envejecimiento saludable. Hoy, la atención deportiva se centra en la emocionante semifinal de la Copa de\nEuropa, donde el prestigioso Real Madrid se enfrenta al poderoso Bayern de Múnich.'
 'Sin embargo, persiste la\nincertidumbre sobre si estos vehículos se convertirán en la principal opción de\ntransporte.'
 'La familia extendida puede enriquecer aún más este\nambiente, proporcionando variedad de perspectivas y contribuciones a la\nconversación y la interacción.']",El Bayern de Munich,0.08333333333333333,0.9999999999,1.0,1.0,0.9456792667395396
3,¿Qué se espera del partido?,"Se espera que el partido sea muy emocionante y mantenga a los espectadores al borde de sus asientos debido a los hábiles pases y los impresionantes goles, ya que el destino de ambos equipos pende de un hilo en esta crucial semifinal de la Copa de Europa.","['Desde los hábiles pases hasta los impresionantes goles, cada\nmomento de este partido crucial llevará a los espectadores al borde de sus asientos,\nmientras el destino de ambos equipos pende de un hilo en esta emocionante\nsemifinal de la Copa de Europa.'
 ''
 'En el entorno de la estación espacial, surge un desafío significativo: la proliferación\nde bacterias que están experimentando mutaciones distintas a las observadas en\ncondiciones terrestres, planteando interrogantes sobre su comportamiento y\nadaptación en entornos extraterrestres.']",Un duelo lleno de intensidad y emoción,0.0,0.9999999999,1.0,1.0,0.9357998321920432
4,¿Cuál es el desafío relacionado con las bacterias en la estación espacial?,"El desafío relacionado con las bacterias en la estación espacial es su proliferación y las mutaciones distintas a las observadas en condiciones terrestres, lo que plantea interrogantes sobre su comportamiento y adaptación en entornos extraterrestres.","['En el entorno de la estación espacial, surge un desafío significativo: la proliferación\nde bacterias que están experimentando mutaciones distintas a las observadas en\ncondiciones terrestres, planteando interrogantes sobre su comportamiento y\nadaptación en entornos extraterrestres.'
 'Desde las olivas y los tomates hasta\nlas hierbas aromáticas y el pescado fresco, cada bocado es una celebración de la\nabundancia y la frescura de los ingredientes locales.'
 'Sin embargo, persiste la\nincertidumbre sobre si estos vehículos se convertirán en la principal opción de\ntransporte.']",La proliferación de bacterias que están experimentando mutaciones distintas a las observadas en condiciones terrestres,0.1,0.9999999999666667,1.0,1.0,1.0000000000000007
5,¿Qué plantea el fenómeno de las mutaciones bacterianas?,El fenómeno de las mutaciones bacterianas plantea interrogantes sobre el comportamiento y la adaptación de las bacterias en entornos extraterrestres.,"['En el entorno de la estación espacial, surge un desafío significativo: la proliferación\nde bacterias que están experimentando mutaciones distintas a las observadas en\ncondiciones terrestres, planteando interrogantes sobre su comportamiento y\nadaptación en entornos extraterrestres.'
 'Desde las olivas y los tomates hasta\nlas hierbas aromáticas y el pescado fresco, cada bocado es una celebración de la\nabundancia y la frescura de los ingredientes locales.'
 '']","No solo preguntas científicas fundamentales, sino también dilemas éticos y prácticos sobre la gestión de la vida
en el espacio y su posible impacto en futuras misiones y la exploración interplanetaria.",0.0,0.9999999999,0.0,1.0,0.9999999999999997
6,¿Cómo fortalece compartir una comida los lazos familiares?,"Compartir una comida fortalece los lazos familiares al reunir a la familia en torno a la mesa, lo que fomenta la conexión emocional y cultiva momentos de alegría y camaradería.","['# Importancia de la Unidad Familiar\nLa importancia de la unidad familiar se destaca en la afirmación de que compartir\nuna comida fortalece los lazos afectivos. Cuando la familia se reúne en torno a la\nmesa, se fomenta la conexión emocional y se cultivan momentos de alegría y\ncamaradería. ## La Dimensión de la Familia: Más es Mejor\nAdemás, la dimensión de la familia juega un papel crucial en esta dinámica, ya que\ncuantos más miembros participen, mayor será la diversión y el sentido de\ncomunidad compartida.'
 'La cocina mediterránea, reconocida mundialmente por su saludable enfoque,\ndestaca por el empleo generoso de aceite de oliva virgen extra, una variedad de\nvegetales frescos y una amplia gama de productos naturales. Los sabores vibrantes y la simplicidad son el sello distintivo de la cocina\nmediterránea, donde los ingredientes de alta calidad se combinan con técnicas de\ncocción sencillas para realzar su sabor natural.'
 '']",Fomentando la conexión emocional y se cultivan momentos de alegría y camaradería,0.1875,0.99999999995,1.0,1.0,0.9453892526674811
7,¿Por qué se destaca la participación de más miembros en las reuniones familiares?,"La participación de más miembros en las reuniones familiares se destaca porque cuantos más miembros participen, mayor será la diversión y el sentido de comunidad compartida.","['# Importancia de la Unidad Familiar\nLa importancia de la unidad familiar se destaca en la afirmación de que compartir\nuna comida fortalece los lazos afectivos. Cuando la familia se reúne en torno a la\nmesa, se fomenta la conexión emocional y se cultivan momentos de alegría y\ncamaradería. ## La Dimensión de la Familia: Más es Mejor\nAdemás, la dimensión de la familia juega un papel crucial en esta dinámica, ya que\ncuantos más miembros participen, mayor será la diversión y el sentido de\ncomunidad compartida.'
 'Desde los hábiles pases hasta los impresionantes goles, cada\nmomento de este partido crucial llevará a los espectadores al borde de sus asientos,\nmientras el destino de ambos equipos pende de un hilo en esta emocionante\nsemifinal de la Copa de Europa.'
 'Este encuentro promete una exhibición de talento y estrategia, mientras millones de\nfanáticos en todo el mundo esperan ansiosamente el desenlace.']","Porque cuantos más miembros participen, mayor será la diversión y el sentido de comunidad compartida",0.0,0.9999999999,1.0,1.0,0.9992729675102745
8,¿Qué incertidumbre hay sobre los vehículos eléctricos?,La incertidumbre sobre los vehículos eléctricos es si se convertirán en la principal opción de transporte.,"['# El Futuro de los Vehículos Eléctricos: Perspectivas y Desafíos\nEl auge de los vehículos eléctricos se vislumbra como un paso significativo hacia un\nfuturo más sostenible y respetuoso con el medio ambiente.'
 'Sin embargo, persiste la\nincertidumbre sobre si estos vehículos se convertirán en la principal opción de\ntransporte.'
 '']","Si estos vehículos se convertirán en la principal opción de
transporte",0.16666666666666666,0.99999999995,1.0,1.0,0.9937121834214694
9,¿Por qué los vehículos eléctricos son una alternativa a los de combustión fósil?,Los vehículos eléctricos son una alternativa a los de combustión fósil porque representan un paso significativo hacia un futuro más sostenible y respetuoso con el medio ambiente.,"['# El Futuro de los Vehículos Eléctricos: Perspectivas y Desafíos\nEl auge de los vehículos eléctricos se vislumbra como un paso significativo hacia un\nfuturo más sostenible y respetuoso con el medio ambiente.'
 'Sin embargo, persiste la\nincertidumbre sobre si estos vehículos se convertirán en la principal opción de\ntransporte.'
 'La cocina mediterránea, reconocida mundialmente por su saludable enfoque,\ndestaca por el empleo generoso de aceite de oliva virgen extra, una variedad de\nvegetales frescos y una amplia gama de productos naturales. Los sabores vibrantes y la simplicidad son el sello distintivo de la cocina\nmediterránea, donde los ingredientes de alta calidad se combinan con técnicas de\ncocción sencillas para realzar su sabor natural.']",Porque ofrecen la posibilidad de reducir las emisiones de gases de efecto invernadero y mitigar los impactos del cambio climático,0.0,0.99999999995,1.0,1.0,1.000000000000001
