,question,answer,contexts,ground_truth,context_relevancy,context_precision,context_recall,faithfulness,answer_relevancy
0,¿Qué beneficios para la salud tiene la cocina mediterránea?,"La cocina mediterránea se ha asociado con una serie de beneficios para la salud, incluyendo la prevención de enfermedades cardiovasculares y la promoción de un envejecimiento saludable.","['La cocina mediterránea, reconocida mundialmente por su saludable enfoque, destaca por el empleo generoso de aceite de oliva virgen extra, una variedad de vegetales frescos y una amplia gama de productos naturales.'
 'La dieta mediterránea no solo es una delicia para el paladar, sino que también se ha asociado con una serie de beneficios para la salud, desde la prevención de enfermedades cardiovasculares hasta la promoción de un envejecimiento saludable.'
 'En el entorno de la estación espacial, surge un desafío significativo: la proliferación de bacterias que están experimentando mutaciones distintas a las observadas en condiciones terrestres, planteando interrogantes sobre su comportamiento y adaptación en entornos extraterrestres.']",Desde la prevención de enfermedades cardiovasculares hasta la promoción de un envejecimiento saludable.,0.0,0.99999999995,1.0,1.0,0.96221066052659
1,¿Cuál es el sello distintivo de la cocina mediterránea?,"El sello distintivo de la cocina mediterránea es el empleo generoso de aceite de oliva virgen extra, una variedad de vegetales frescos y una amplia gama de productos naturales.","['La cocina mediterránea, reconocida mundialmente por su saludable enfoque, destaca por el empleo generoso de aceite de oliva virgen extra, una variedad de vegetales frescos y una amplia gama de productos naturales.'
 'Este encuentro promete una exhibición de talento y estrategia, mientras millones de fanáticos en todo el mundo esperan ansiosamente el desenlace.'
 '# El Futuro de los Vehículos Eléctricos: Perspectivas y Desafíos']",Los sabores vibrantes y la simplicidad,0.0,0.9999999999,1.0,1.0,1.0000000000000002
2,¿Quién se enfrenta al Real Madrid?,El Real Madrid se enfrenta al Bayern de Múnich.,"['Hoy, la atención deportiva se centra en la emocionante semifinal de la Copa de Europa, donde el prestigioso Real Madrid se enfrenta al poderoso Bayern de Múnich.'
 'Sin embargo, persiste la incertidumbre sobre si estos vehículos se convertirán en la principal opción de transporte.'
 'Desde las olivas y los tomates hasta las hierbas aromáticas y el pescado fresco, cada bocado es una celebración de la abundancia y la frescura de los ingredientes locales.']",El Bayern de Munich,0.3333333333333333,0.9999999999,1.0,1.0,0.9633538411117436
3,¿Qué se espera del partido?,"Se espera que el partido sea emocionante y mantenga a los espectadores al borde de sus asientos, con momentos cruciales como hábiles pases e impresionantes goles, ya que el destino de ambos equipos pende de un hilo en esta semifinal de la Copa de Europa.","['# Importancia de la Unidad Familiar'
 'Desde los hábiles pases hasta los impresionantes goles, cada momento de este partido crucial llevará a los espectadores al borde de sus asientos, mientras el destino de ambos equipos pende de un hilo en esta emocionante semifinal de la Copa de Europa.'
 'El auge de los vehículos eléctricos se vislumbra como un paso significativo hacia un futuro más sostenible y respetuoso con el medio ambiente.']",Un duelo lleno de intensidad y emoción,0.0,0.49999999995,1.0,1.0,0.9511462485032124
4,¿Cuál es el desafío relacionado con las bacterias en la estación espacial?,"El desafío relacionado con las bacterias en la estación espacial es la proliferación de bacterias que están experimentando mutaciones distintas a las observadas en condiciones terrestres, planteando interrogantes sobre su comportamiento y adaptación en entornos extraterrestres.","['En el entorno de la estación espacial, surge un desafío significativo: la proliferación de bacterias que están experimentando mutaciones distintas a las observadas en condiciones terrestres, planteando interrogantes sobre su comportamiento y adaptación en entornos extraterrestres.'
 'Desde las olivas y los tomates hasta las hierbas aromáticas y el pescado fresco, cada bocado es una celebración de la abundancia y la frescura de los ingredientes locales.'
 '# Importancia de la Unidad Familiar']",La proliferación de bacterias que están experimentando mutaciones distintas a las observadas en condiciones terrestres,0.0,0.8333333332916666,1.0,1.0,1.0000000000000007
5,¿Qué plantea el fenómeno de las mutaciones bacterianas?,El fenómeno de las mutaciones bacterianas plantea interrogantes sobre el comportamiento y adaptación de las bacterias en entornos extraterrestres.,"['En el entorno de la estación espacial, surge un desafío significativo: la proliferación de bacterias que están experimentando mutaciones distintas a las observadas en condiciones terrestres, planteando interrogantes sobre su comportamiento y adaptación en entornos extraterrestres.'
 'Desde las olivas y los tomates hasta las hierbas aromáticas y el pescado fresco, cada bocado es una celebración de la abundancia y la frescura de los ingredientes locales.'
 '# El Futuro de los Vehículos Eléctricos: Perspectivas y Desafíos']","No solo preguntas científicas fundamentales, sino también dilemas éticos y prácticos sobre la gestión de la vida
en el espacio y su posible impacto en futuras misiones y la exploración interplanetaria.",0.0,0.9999999999,0.0,1.0,0.9999999999999997
6,¿Cómo fortalece compartir una comida los lazos familiares?,"Compartir una comida fortalece los lazos familiares al proporcionar una oportunidad para que los miembros de la familia se reúnan y disfruten juntos, lo cual puede mejorar la comunicación y el afecto entre ellos.","['La importancia de la unidad familiar se destaca en la afirmación de que compartir una comida fortalece los lazos afectivos.'
 'Con jugadores de clase mundial en ambos lados del campo, se espera un duelo lleno de intensidad y emoción.'
 'Los sabores vibrantes y la simplicidad son el sello distintivo de la cocina mediterránea, donde los ingredientes de alta calidad se combinan con técnicas de cocción sencillas para realzar su sabor natural.']",Fomentando la conexión emocional y se cultivan momentos de alegría y camaradería,0.0,0.9999999999,0.5,1.0,0.9432377015487937
7,¿Por qué se destaca la participación de más miembros en las reuniones familiares?,"La participación de más miembros en las reuniones familiares se destaca porque cuantos más miembros participen, mayor será la diversión y el sentido de comunidad compartida.","['Además, la dimensión de la familia juega un papel crucial en esta dinámica, ya que cuantos más miembros participen, mayor será la diversión y el sentido de comunidad compartida.'
 '# Importancia de la Unidad Familiar'
 'Estas mutaciones, diferentes a las que se observan en la Tierra, despiertan cuestionamientos profundos sobre cómo la vida se adapta y evoluciona en condiciones extraterrestres.']","Porque cuantos más miembros participen, mayor será la diversión y el sentido de comunidad compartida",0.3333333333333333,0.99999999995,1.0,1.0,1.0000000000000002
8,¿Qué incertidumbre hay sobre los vehículos eléctricos?,La incertidumbre sobre los vehículos eléctricos es si se convertirán en la principal opción de transporte.,"['# El Futuro de los Vehículos Eléctricos: Perspectivas y Desafíos'
 'Los vehículos eléctricos representan una alternativa prometedora a los combustibles fósiles, ofreciendo la posibilidad de reducir las emisiones de gases de efecto invernadero y mitigar los impactos del cambio climático.'
 'Sin embargo, persiste la incertidumbre sobre si estos vehículos se convertirán en la principal opción de transporte.']","Si estos vehículos se convertirán en la principal opción de
transporte",0.3333333333333333,0.5833333333041666,1.0,1.0,0.9937121834214694
9,¿Por qué los vehículos eléctricos son una alternativa a los de combustión fósil?,Los vehículos eléctricos son una alternativa a los de combustión fósil porque ofrecen la posibilidad de reducir las emisiones de gases de efecto invernadero y mitigar los impactos del cambio climático.,"['Los vehículos eléctricos representan una alternativa prometedora a los combustibles fósiles, ofreciendo la posibilidad de reducir las emisiones de gases de efecto invernadero y mitigar los impactos del cambio climático.'
 '# El Futuro de los Vehículos Eléctricos: Perspectivas y Desafíos'
 '## La Dimensión de la Familia: Más es Mejor']",Porque ofrecen la posibilidad de reducir las emisiones de gases de efecto invernadero y mitigar los impactos del cambio climático,0.3333333333333333,0.9999999999666667,0.5,1.0,1.000000000000001
