,question,answer,contexts,ground_truth,context_relevancy,context_precision,context_recall,faithfulness,answer_relevancy
0,¿Qué beneficios para la salud tiene la cocina mediterránea?,"Lo siento, no puedo proporcionar una respuesta basada en el contexto dado, ya que no se ha proporcionado ningún contexto específico en el mensaje.",[],Desde la prevención de enfermedades cardiovasculares hasta la promoción de un envejecimiento saludable.,0.0,0.0,1.0,,0.0
1,¿Cuál es el sello distintivo de la cocina mediterránea?,"El sello distintivo de la cocina mediterránea son los sabores vibrantes y la simplicidad, donde los ingredientes de alta calidad se combinan con técnicas de cocción sencillas para realzar su sabor natural.","['La cocina mediterránea, reconocida mundialmente por su saludable enfoque, destaca por el empleo generoso de aceite de oliva virgen extra, una variedad de vegetales frescos y una amplia gama de productos naturales.\nLos sabores vibrantes y la simplicidad son el sello distintivo de la cocina mediterránea, donde los ingredientes de alta calidad se combinan con técnicas de cocción sencillas para realzar su sabor natural. Desde las olivas y los tomates hasta las hierbas aromáticas y el pescado fresco, cada bocado es una celebración de la abundancia y la frescura de los ingredientes locales. La dieta mediterránea no solo es una delicia para el paladar, sino que también se ha asociado con una serie de beneficios para la salud, desde la prevención de enfermedades cardiovasculares hasta la promoción de un envejecimiento saludable.']",Los sabores vibrantes y la simplicidad,0.5,0.9999999999,1.0,1.0,0.9999999999999997
2,¿Quién se enfrenta al Real Madrid?,El Real Madrid se enfrenta al Bayern de Múnich.,"['Hoy, la atención deportiva se centra en la emocionante semifinal de la Copa de Europa, donde el prestigioso Real Madrid se enfrenta al poderoso Bayern de Múnich. Este encuentro promete una exhibición de talento y estrategia, mientras millones de fanáticos en todo el mundo esperan ansiosamente el desenlace.\nLa atmósfera eléctrica envuelve el estadio mientras los aficionados se preparan para presenciar un enfrentamiento legendario entre dos gigantes del fútbol europeo. Con jugadores de clase mundial en ambos lados del campo, se espera un duelo lleno de intensidad y emoción. Desde los hábiles pases hasta los impresionantes goles, cada momento de este partido crucial llevará a los espectadores al borde de sus asientos, mientras el destino de ambos equipos pende de un hilo en esta emocionante semifinal de la Copa de Europa.']",El Bayern de Munich,0.2,0.9999999999,1.0,1.0,0.9515390360813917
3,¿Qué se espera del partido?,"Se espera un duelo lleno de intensidad y emoción, con una exhibición de talento y estrategia por parte de ambos equipos, el Real Madrid y el Bayern de Múnich.","['Hoy, la atención deportiva se centra en la emocionante semifinal de la Copa de Europa, donde el prestigioso Real Madrid se enfrenta al poderoso Bayern de Múnich. Este encuentro promete una exhibición de talento y estrategia, mientras millones de fanáticos en todo el mundo esperan ansiosamente el desenlace.\nLa atmósfera eléctrica envuelve el estadio mientras los aficionados se preparan para presenciar un enfrentamiento legendario entre dos gigantes del fútbol europeo. Con jugadores de clase mundial en ambos lados del campo, se espera un duelo lleno de intensidad y emoción. Desde los hábiles pases hasta los impresionantes goles, cada momento de este partido crucial llevará a los espectadores al borde de sus asientos, mientras el destino de ambos equipos pende de un hilo en esta emocionante semifinal de la Copa de Europa.']",Un duelo lleno de intensidad y emoción,0.4,0.9999999999,1.0,1.0,0.8941341849550467
4,¿Cuál es el desafío relacionado con las bacterias en la estación espacial?,"Lo siento, pero no hay suficiente contexto proporcionado para responder a la pregunta sobre el desafío relacionado con las bacterias en la estación espacial.",[],La proliferación de bacterias que están experimentando mutaciones distintas a las observadas en condiciones terrestres,0.0,0.0,0.0,,0.0
5,¿Qué plantea el fenómeno de las mutaciones bacterianas?,"El fenómeno de las mutaciones bacterianas en el entorno de la estación espacial plantea interrogantes sobre cómo la vida se adapta y evoluciona en condiciones extraterrestres. Además, suscita preguntas científicas fundamentales y dilemas éticos y prácticos sobre la gestión de la vida en el espacio y su posible impacto en futuras misiones y la exploración interplanetaria.","['En el entorno de la estación espacial, surge un desafío significativo: la proliferación de bacterias que están experimentando mutaciones distintas a las observadas en condiciones terrestres, planteando interrogantes sobre su comportamiento y adaptación en entornos extraterrestres.\nLa expansión del conocimiento humano hacia el espacio exterior no está exenta de desafíos, y uno de los más intrigantes se manifiesta en la forma de bacterias que se adaptan y mutan de maneras inesperadas en el entorno único de una estación espacial. Estas mutaciones, diferentes a las que se observan en la Tierra, despiertan cuestionamientos profundos sobre cómo la vida se adapta y evoluciona en condiciones extraterrestres. Este fenómeno plantea no solo preguntas científicas fundamentales, sino también dilemas éticos y prácticos sobre la gestión de la vida en el espacio y su posible impacto en futuras misiones y la exploración interplanetaria.']","No solo preguntas científicas fundamentales, sino también dilemas éticos y prácticos sobre la gestión de la vida
en el espacio y su posible impacto en futuras misiones y la exploración interplanetaria.",0.5,0.9999999999,1.0,1.0,0.9533351956922235
6,¿Cómo fortalece compartir una comida los lazos familiares?,El contexto no proporciona información suficiente para responder a la pregunta sobre cómo compartir una comida fortalece los lazos familiares.,[],Fomentando la conexión emocional y se cultivan momentos de alegría y camaradería,0.0,0.0,0.5,,0.0
7,¿Por qué se destaca la participación de más miembros en las reuniones familiares?,La pregunta no puede ser respondida con el contexto proporcionado.,[],"Porque cuantos más miembros participen, mayor será la diversión y el sentido de comunidad compartida",0.0,0.0,0.0,,0.0
8,¿Qué incertidumbre hay sobre los vehículos eléctricos?,La incertidumbre sobre los vehículos eléctricos es si se convertirán en la principal opción de transporte.,"['# El Futuro de los Vehículos Eléctricos: Perspectivas y Desafíos\nEl auge de los vehículos eléctricos se vislumbra como un paso significativo hacia un\nfuturo más sostenible y respetuoso con el medio ambiente. Sin embargo, persiste la\nincertidumbre sobre si estos vehículos se convertirán en la principal opción de\ntransporte.']","Si estos vehículos se convertirán en la principal opción de
transporte",0.0,0.9999999999,1.0,1.0,0.9937200879003932
9,¿Por qué los vehículos eléctricos son una alternativa a los de combustión fósil?,"Lo siento, pero no puedo responder a esa pregunta basándome solo en el contexto proporcionado, ya que no se ha incluido ningún contexto en tu mensaje.",[],Porque ofrecen la posibilidad de reducir las emisiones de gases de efecto invernadero y mitigar los impactos del cambio climático,0.0,0.0,1.0,,0.0
